{"bootstrap_id":"nmrpa.real_trust.bootstrap.v1","capabilities":{"create_storage":false,"issue_authorization":false,"read_payload":false,"record_trust":false,"run_real_date":false},"descriptor_sha256":"398a73e3041a574f7f8d6294d60026ad50da1290facb5f0c2b6248751d970709","fixed_logs":[{"bootstrap_order":1,"commit_marker_locator":"data_tw/artifacts/research/nmrpa/trust_bootstrap_v1/fixed_logs/principal_registry_log/commit_markers","current_head_locator":"data_tw/artifacts/research/nmrpa/trust_bootstrap_v1/fixed_logs/principal_registry_log/head.json","genesis_locator":"data_tw/artifacts/research/nmrpa/trust_bootstrap_v1/fixed_logs/principal_registry_log/genesis.json","historical_heads_locator":"data_tw/artifacts/research/nmrpa/trust_bootstrap_v1/fixed_logs/principal_registry_log/historical_heads.json","journal_locator":"data_tw/artifacts/research/nmrpa/trust_bootstrap_v1/fixed_logs/principal_registry_log/journals","log_id":"nmrpa.principal_registry.v1","log_kind":"issuer_registry","logical_name":"principal_registry_log","owner_role":"trust_registry_issuer","storage_id":"nmrpa.storage.principal_registry_log.v1","storage_project_relative_path":"data_tw/artifacts/research/nmrpa/trust_bootstrap_v1/fixed_logs/principal_registry_log"},{"bootstrap_order":2,"commit_marker_locator":"data_tw/artifacts/research/nmrpa/trust_bootstrap_v1/fixed_logs/identity_registry_log/commit_markers","current_head_locator":"data_tw/artifacts/research/nmrpa/trust_bootstrap_v1/fixed_logs/identity_registry_log/head.json","genesis_locator":"data_tw/artifacts/research/nmrpa/trust_bootstrap_v1/fixed_logs/identity_registry_log/genesis.json","historical_heads_locator":"data_tw/artifacts/research/nmrpa/trust_bootstrap_v1/fixed_logs/identity_registry_log/historical_heads.json","journal_locator":"data_tw/artifacts/research/nmrpa/trust_bootstrap_v1/fixed_logs/identity_registry_log/journals","log_id":"nmrpa.identity_registry.v1","log_kind":"issuer_registry","logical_name":"identity_registry_log","owner_role":"trust_registry_issuer","storage_id":"nmrpa.storage.identity_registry_log.v1","storage_project_relative_path":"data_tw/artifacts/research/nmrpa/trust_bootstrap_v1/fixed_logs/identity_registry_log"},{"bootstrap_order":3,"commit_marker_locator":"data_tw/artifacts/research/nmrpa/trust_bootstrap_v1/fixed_logs/credential_registry_log/commit_markers","current_head_locator":"data_tw/artifacts/research/nmrpa/trust_bootstrap_v1/fixed_logs/credential_registry_log/head.json","genesis_locator":"data_tw/artifacts/research/nmrpa/trust_bootstrap_v1/fixed_logs/credential_registry_log/genesis.json","historical_heads_locator":"data_tw/artifacts/research/nmrpa/trust_bootstrap_v1/fixed_logs/credential_registry_log/historical_heads.json","journal_locator":"data_tw/artifacts/research/nmrpa/trust_bootstrap_v1/fixed_logs/credential_registry_log/journals","log_id":"nmrpa.credential_registry.v1","log_kind":"issuer_registry","logical_name":"credential_registry_log","owner_role":"trust_registry_issuer","storage_id":"nmrpa.storage.credential_registry_log.v1","storage_project_relative_path":"data_tw/artifacts/research/nmrpa/trust_bootstrap_v1/fixed_logs/credential_registry_log"},{"bootstrap_order":4,"commit_marker_locator":"data_tw/artifacts/research/nmrpa/trust_bootstrap_v1/fixed_logs/trusted_service_registration_log/commit_markers","current_head_locator":"data_tw/artifacts/research/nmrpa/trust_bootstrap_v1/fixed_logs/trusted_service_registration_log/head.json","genesis_locator":"data_tw/artifacts/research/nmrpa/trust_bootstrap_v1/fixed_logs/trusted_service_registration_log/genesis.json","historical_heads_locator":"data_tw/artifacts/research/nmrpa/trust_bootstrap_v1/fixed_logs/trusted_service_registration_log/historical_heads.json","journal_locator":"data_tw/artifacts/research/nmrpa/trust_bootstrap_v1/fixed_logs/trusted_service_registration_log/journals","log_id":"nmrpa.trusted_service_registration.v1","log_kind":"issuer_registry","logical_name":"trusted_service_registration_log","owner_role":"trust_registry_issuer","storage_id":"nmrpa.storage.trusted_service_registration_log.v1","storage_project_relative_path":"data_tw/artifacts/research/nmrpa/trust_bootstrap_v1/fixed_logs/trusted_service_registration_log"},{"bootstrap_order":5,"commit_marker_locator":"data_tw/artifacts/research/nmrpa/trust_bootstrap_v1/fixed_logs/publication_authority_registration_log/commit_markers","current_head_locator":"data_tw/artifacts/research/nmrpa/trust_bootstrap_v1/fixed_logs/publication_authority_registration_log/head.json","genesis_locator":"data_tw/artifacts/research/nmrpa/trust_bootstrap_v1/fixed_logs/publication_authority_registration_log/genesis.json","historical_heads_locator":"data_tw/artifacts/research/nmrpa/trust_bootstrap_v1/fixed_logs/publication_authority_registration_log/historical_heads.json","journal_locator":"data_tw/artifacts/research/nmrpa/trust_bootstrap_v1/fixed_logs/publication_authority_registration_log/journals","log_id":"nmrpa.publication_authority_registration.v1","log_kind":"publication_authority_registry","logical_name":"publication_authority_registration_log","owner_role":"trust_registry_issuer","storage_id":"nmrpa.storage.publication_authority_registration_log.v1","storage_project_relative_path":"data_tw/artifacts/research/nmrpa/trust_bootstrap_v1/fixed_logs/publication_authority_registration_log"},{"bootstrap_order":6,"commit_marker_locator":"data_tw/artifacts/research/nmrpa/trust_bootstrap_v1/fixed_logs/capture_recorder_registration_log/commit_markers","current_head_locator":"data_tw/artifacts/research/nmrpa/trust_bootstrap_v1/fixed_logs/capture_recorder_registration_log/head.json","genesis_locator":"data_tw/artifacts/research/nmrpa/trust_bootstrap_v1/fixed_logs/capture_recorder_registration_log/genesis.json","historical_heads_locator":"data_tw/artifacts/research/nmrpa/trust_bootstrap_v1/fixed_logs/capture_recorder_registration_log/historical_heads.json","journal_locator":"data_tw/artifacts/research/nmrpa/trust_bootstrap_v1/fixed_logs/capture_recorder_registration_log/journals","log_id":"nmrpa.capture_recorder_registration.v1","log_kind":"capture_recorder_registry","logical_name":"capture_recorder_registration_log","owner_role":"trust_registry_issuer","storage_id":"nmrpa.storage.capture_recorder_registration_log.v1","storage_project_relative_path":"data_tw/artifacts/research/nmrpa/trust_bootstrap_v1/fixed_logs/capture_recorder_registration_log"}],"mode":"descriptor_only_no_payload_read","root_reservations":[{"activation_ref":null,"base_id":"nmrpa_isolated_source_base_v1","base_project_relative_path":"data_tw/artifacts/research/nmrpa/immutable_source_roots","locator_token":"NMRPA_REAL_ROOT_SEALED_CALENDAR_V1","order":1,"payload_present":false,"reservation_status":"reserved_empty","root_id":"nmrpa_sealed_calendar_root_v1","root_kind":"sealed_calendar","root_project_relative_path":"data_tw/artifacts/research/nmrpa/immutable_source_roots/sealed_calendar/nmrpa_sealed_calendar_root_v1","seal_ref":null},{"activation_ref":null,"base_id":"nmrpa_isolated_source_base_v1","base_project_relative_path":"data_tw/artifacts/research/nmrpa/immutable_source_roots","locator_token":"NMRPA_REAL_ROOT_FORMAL_INSTRUMENTS_V1","order":2,"payload_present":false,"reservation_status":"reserved_empty","root_id":"nmrpa_formal_instruments_root_v1","root_kind":"formal_instruments","root_project_relative_path":"data_tw/artifacts/research/nmrpa/immutable_source_roots/formal_instruments/nmrpa_formal_instruments_root_v1","seal_ref":null},{"activation_ref":null,"base_id":"nmrpa_isolated_source_base_v1","base_project_relative_path":"data_tw/artifacts/research/nmrpa/immutable_source_roots","locator_token":"NMRPA_REAL_ROOT_ADJUSTED_PRICE_V1","order":3,"payload_present":false,"reservation_status":"reserved_empty","root_id":"nmrpa_adjusted_price_root_v1","root_kind":"adjusted_price","root_project_relative_path":"data_tw/artifacts/research/nmrpa/immutable_source_roots/adjusted_price/nmrpa_adjusted_price_root_v1","seal_ref":null},{"activation_ref":null,"base_id":"nmrpa_isolated_source_base_v1","base_project_relative_path":"data_tw/artifacts/research/nmrpa/immutable_source_roots","locator_token":"NMRPA_REAL_ROOT_TWII_V1","order":4,"payload_present":false,"reservation_status":"reserved_empty","root_id":"nmrpa_twii_root_v1","root_kind":"twii","root_project_relative_path":"data_tw/artifacts/research/nmrpa/immutable_source_roots/twii/nmrpa_twii_root_v1","seal_ref":null},{"activation_ref":null,"base_id":"nmrpa_isolated_source_base_v1","base_project_relative_path":"data_tw/artifacts/research/nmrpa/immutable_source_roots","locator_token":"NMRPA_REAL_ROOT_MODELA_SIGNAL_V1","order":5,"payload_present":false,"reservation_status":"reserved_empty","root_id":"nmrpa_modela_signal_root_v1","root_kind":"modela_signal","root_project_relative_path":"data_tw/artifacts/research/nmrpa/immutable_source_roots/modela_signal/nmrpa_modela_signal_root_v1","seal_ref":null}],"runtime_overrides":{},"schema_version":"nmrpa.real_trust_bootstrap.v1","trust_stores":[{"caller_pinned":true,"env_override_allowed":false,"order":1,"package_override_allowed":false,"project_relative_path":"data_tw/artifacts/research/nmrpa/trust_bootstrap_v1/stores/root_locator_registry","runtime_override_allowed":false,"store_id":"nmrpa.store.root_locator_registry.v1","store_kind":"root_locator_registry"},{"caller_pinned":true,"env_override_allowed":false,"order":2,"package_override_allowed":false,"project_relative_path":"data_tw/artifacts/research/nmrpa/trust_bootstrap_v1/stores/principal_identity_credential_registry_stores","runtime_override_allowed":false,"store_id":"nmrpa.store.principal_identity_credential_registry_stores.v1","store_kind":"principal_identity_credential_registry_stores"},{"caller_pinned":true,"env_override_allowed":false,"order":3,"package_override_allowed":false,"project_relative_path":"data_tw/artifacts/research/nmrpa/trust_bootstrap_v1/stores/trusted_actor_registry_stores","runtime_override_allowed":false,"store_id":"nmrpa.store.trusted_actor_registr